video_url,user_url,username,title,view_num,created_at,shortdesc,collected_at
/watch?v=3NSg709MNDk&pp=ygUSQ2hhcmxvdHRlIHVyYmFuaXNt,/@alexanderrotmensz,Alexander Rotmensz,Just How Good Is Charlotte's Attempt At Urbanism?,12K,9 months,,14:37.2
/watch?v=QgZcQIp4CL0&pp=ygUSQ2hhcmxvdHRlIHVyYmFuaXNt,/@CityNerd,Ray Delahanty | CityNerd,"I Visited the World Capital of Sprawl, and I Have Thoughts",482K,2 years,"I went on location in Charlotte, North Carolina to find out what makes this the most car-centric major city in the U.S., and, by some ...",14:37.2
/watch?v=f8186dtXGUg&pp=ygUSQ2hhcmxvdHRlIHVyYmFuaXNt,/@alexanderrotmensz,Alexander Rotmensz,America's Rising Cities: Charlotte,41K,6 months,,14:37.2
/watch?v=aFM3PTpD-aI&pp=ygUSQ2hhcmxvdHRlIHVyYmFuaXNt,/@WCNC,WCNC,Centre South development aims to reshape Charlotte's South End,333,3 months,"A massive new development is planned for Charlotte's South End, with promises to bring density, affordable housing and new ...",14:37.2
/watch?v=ku7E5gSWIrI&pp=ygUSQ2hhcmxvdHRlIHVyYmFuaXNt,/@WCNC,WCNC,Residents weigh in on 2040 plan for Charlotte development,861,6 months,"With the Queen City expected to add nearly 400000 residents and 200000 new jobs over the next 15 years, Charlotte officials are ...",14:37.2
/watch?v=RxCNVJ5AmqE&pp=ygUSQ2hhcmxvdHRlIHVyYmFuaXNt,/@CityNerd,Ray Delahanty | CityNerd,"Why I Love North Carolina, Part 1: Triad",110K,1 year,"The Piedmont Triad: a bit forgotten on the way between Charlotte and the Raleigh/Durham, but it shouldn't be. Winston-Salem is ...",14:37.2
/watch?v=TW0yN4BgUlc&pp=ygUSQ2hhcmxvdHRlIHVyYmFuaXNt0gcJCU8KAYcqIYzv,/@unccharlotteofficial,UNC Charlotte,Tactical Urbanism Street Mural,1K,8 years,The UNC Charlotte College of Arts + Architecture's “Tactical Urbanism” class has partnered with the Charlotte Department of ...,14:37.2
/watch?v=G5sc6mNmwAU&pp=ygUSQ2hhcmxvdHRlIHVyYmFuaXNt,/@QueenCityNews,Queen City News,Charlotte Urbanists working to bring more benches to city streets,179,3 years,A Charlotte group modeled after an Asheville non-profit wants to bring more benches to city streets around the QC. Thanks for ...,14:37.2
/watch?v=dpS1trQHLD0&pp=ygUSQ2hhcmxvdHRlIHVyYmFuaXNt,/@QueenCityNews,Queen City News,"Birkdale Village a blueprint for urban development, national organization says",248,2 years,"I was looking for a Sephora for my mom to return something,” Tiffany Moses said. “So, I just put it in the search, and it brought me ...",14:37.2
/watch?v=j3El8DIftKo&t=129s&pp=ygUSQ2hhcmxvdHRlIHVyYmFuaXNt,/@TransitTangents,Transit Tangents,Charlotte NC Just Bought a Railroad: What's Next?,14K,1 year,... Charlotte Urbanists Gold Line Tweet: https://x.com/CLT_Urbanists/status/1832199860562337819 Chapters: 00:00 - Introduction ...,14:37.2
/watch?v=aeOCr7EHgE8&pp=ygUSQ2hhcmxvdHRlIHVyYmFuaXNt,/@CharlotteGOVchannel,City of Charlotte,Charlotte's 2023 Urban Design Award Winners,260,2 years,The City of Charlotte Urban Design Center and the University of North Carolina at Charlotte School of Architecture presented the ...,14:37.2
/watch?v=T7KnOljrtNM&pp=ygUSQ2hhcmxvdHRlIHVyYmFuaXNt,/@unccharlotteofficial,UNC Charlotte,UNC Charlotte's UrbanEden: Being Green,254,12 years,"Charlotte, North Carolina, is a fast-growing city, committed to revitalizing its urban center as a vibrant focal point of a thriving ...",14:37.2
/watch?v=fjwGyQF__Bw&pp=ygUSQ2hhcmxvdHRlIHVyYmFuaXNt,/@unccharlotteofficial,UNC Charlotte,Master of Urban Design at UNC Charlotte,4.1K,12 years,UNC Charlotte's Master of Urban Design allows students the opportunity to learn from and collaborate with a diverse group of ...,14:37.2
/watch?v=ml6S08i7das&pp=ygUSQ2hhcmxvdHRlIHVyYmFuaXNt,/@WBTVNews,WBTV News - Charlotte,Charlotte Urban Design Center brining the city to life,65,11 months,,14:37.2
/watch?v=tm8lhYTPzjg&pp=ygUSQ2hhcmxvdHRlIHVyYmFuaXNt,/@WCNC,WCNC,Study: These suburbs near Charlotte are among the best in the country,531,3 years,Some people want to escape the hustle and bustle of a large city and settle their family down in a nice suburb. But with sprawling ...,14:37.2
/watch?v=wz2Imh1QKTo&pp=ygUSQ2hhcmxvdHRlIHVyYmFuaXNt,/@CharlotteGOVchannel,City of Charlotte,Congress for the New Urbanism Hosts Neighborhood Charrettes to Create People-Centered Places,234,2 years,"Within a span of 11 days, three charrettes – intense periods of collaborative design and planning – were held to focus on ...",14:37.2
/watch?v=alRtuOd7oP4&pp=ygUSQ2hhcmxvdHRlIHVyYmFuaXNt,/@CitiesofLions,Cities of Lions,NFL Urbanism Episode 7 | Bank of America Stadium | Carolina Panthers,57,3 months,"Heading down to uptown Charlotte to grade the urban planning around Bank of America Stadium, the first stadium to be funded ...",14:37.2
/watch?v=NTcOLqFV5fQ&pp=ygUSQ2hhcmxvdHRlIHVyYmFuaXNt,/@realizecharlotte,Realize Charlotte,"Charlotte, NC Suburbs Explained: Where Should You Live?",47K,5 months,"In this video, I'm explaining everything you need to know about Charlotte, NC, suburbs -- Where should you live in 2025?",14:37.2
/shorts/iCE_a-9f2xU,/@NYCandCharlotteNCVLog,NYC and CharlotteNC VLog,Charlotte NC - Don't Park on Tracks:( - Part1,28M,2 years,A car parked on the Lightrail tracks causes a halt in train service during rush hours. Part 2 is available on this channel.,14:44.4
/watch?v=2V0aBhat_zw&pp=ygUSQ2hhcmxvdHRlIHVyYmFuaXNt,/@livingincharlotteshawngerald,Living In Charlotte North Carolina,Why I Am Leaving Charlotte North Carolina: My Story & Insights In Charlotte NC | NC Real Estate,71K,1 year,Are you thinking about moving to Charlotte North Carolina? I'll discuss the changes and challenges that have led to my decision ...,14:44.5
/watch?v=OVBL1mCSPMY&pp=ygUSQ2hhcmxvdHRlIHVyYmFuaXNt,/@ActiveTowns,Active Towns,Visiting Charlotte's Bicycle-Oriented Development Sites,1.3K,2 years,"In this finale of the #CNU31 BODs (Bicycle Oriented Development) Tour in Charlotte, NC, we explore several development sites ...",14:44.5
/watch?v=JSa31h-v4d4&pp=ygUSQ2hhcmxvdHRlIHVyYmFuaXNt,/@UrbanPlannerExplained,Urban Planner Explained,Every WORST Designed City Explained in 9 Minutes,1.1M,3 months,"Have you ever walked through a city and thought, ""Who on earth designed this mess?"" Or wondered why some places seem ...",14:44.5
/watch?v=gARgOZh7HEo&pp=ygUSQ2hhcmxvdHRlIHVyYmFuaXNt,/@advisorSirAshley,Real Estate Advisor Sir Ashley | Charlotte Area ,Charlotte vs. Atlanta: Which City Wins in 2025? 🏙️,3K,10 months,Charlotte vs. Atlanta: Which City Wins in 2025? 🏙️ http://www.SirAshley.com Interested in Buying a Home? go here: ...,14:44.5
/watch?v=l5MwHHEEa5Y&pp=ygUSQ2hhcmxvdHRlIHVyYmFuaXNt,/@WCNC,WCNC,Charlotte grassroots organization installing benches at bus stops,1.1K,3 years,One Charlotte grassroots organization is trying to ease the load on public transit riders. Charlotte Urbanists is working to add ...,14:44.5
/watch?v=sOaXfc9MuKc&pp=ygUSQ2hhcmxvdHRlIHVyYmFuaXNt,/@CityBeautiful,City Beautiful,What is New Urbanism?,407K,6 years,Watch over 2400 documentaries with Curiosity Stream for free for a month by signing up at http://CuriosityStream.com/citybeautiful ...,14:44.5
/watch?v=4-WcOapa5aU&pp=ygUSQ2hhcmxvdHRlIHVyYmFuaXNt,/@cooperunion,The Cooper Union,03.03.22 Student Lecture Series | Charlotte Malterre-Barthes: Manoeuvring Boundaries,933,3 years,"Charlotte Malterre-Barthes is assistant professor of urban design at Harvard Graduate School of Design. Architect, urban designer ...",14:44.5
/watch?v=HwwCb9ovXN4&pp=ygUSQ2hhcmxvdHRlIHVyYmFuaXNt,/@OhTheUrbanity,Oh The Urbanity!,The Urbanist Myth That Just Won’t Die,179K,2 years,This is the urbanist myth that just won't die: the one very mistaken idea about housing and density held by a lot of well-meaning ...,14:44.5
/watch?v=F6B3tX2QwbQ&pp=ygUSQ2hhcmxvdHRlIHVyYmFuaXNt,/@ActiveTowns,Active Towns,CNU.Charlotte BODs Bike Tour ~ Part One,686,2 years,"Beyond a TOD (Transit Oriented Development), there is a BOD (Bicycle Oriented Development), and we got to tour a few on ...",14:44.5
/watch?v=dOhF3cvL5Yg&t=213s&pp=ygUSQ2hhcmxvdHRlIHVyYmFuaXNt,/@UrbanPlannerExplained,Urban Planner Explained,Every WORST Designed City Explained in 9 Minutes (Part2),71K,2 months,"You asked for more, so we're back. Did you think we had found all the world's planning disasters? Not even close. In this video, as ...",14:44.5
/shorts/dFPa7BqDr8s,/@Lukewarm_Flapjack,Lukewarm Flapjack,5 Things I Wish I Knew About Urban Planning,1.9K,4 months,urbanplanning #urbanism #cityplanning #planning.,14:44.5
/watch?v=6JZRRiSzZ_Q&pp=ygUSQ2hhcmxvdHRlIHVyYmFuaXNt,/@CanopyREALTORAssociation,Canopy REALTOR Association,Form-Based Zoning - The Right Choice for Charlotte?,91,11 years,"Watch a community conversation on form-based zoning, exploring what works (and what often doesn't) when cities zone for ...",14:44.5
/watch?v=NoollbCIgLY&pp=ygUSQ2hhcmxvdHRlIHVyYmFuaXNt,/@CharlotteGOVchannel,City of Charlotte,2021 Charlotte Urban Design Awards,321,4 years,The City of Charlotte Urban Design Center and the University of North Carolina at Charlotte School of Architecture presented the ...,14:44.5
/watch?v=wrVRE7QEC34&pp=ygUSQ2hhcmxvdHRlIHVyYmFuaXNt0gcJCU8KAYcqIYzv,/@amandalanata,Amanda Lanata,Charlotte CNU/Strong Towns experience by Amanda Lanata,14,2 years,"Initial thoughts and reactions to Charlotte, NC! We visited in May 2023 to attend the Strong Towns National Gathering and ...",14:44.5
/shorts/yh9pEg6_KGw,/@grant-taleck,Grant Taleck,"Camp North End in Charlotte, NC",520,2 years,"Recently I met Tesho Akindele at Camp North End in Charlotte, NC. He walked me through these massive Industrial Buildings that ...",14:44.5
/watch?v=GzA5e9O9Lxc&pp=ygUSQ2hhcmxvdHRlIHVyYmFuaXNt,/@clt_coaa,UNC Charlotte College of Arts + Architecture,2024 SoA Lecture: Gabriela Rendon,68,2 years,architecture.charlotte.edu Gabriela Rendón is an Associate Professor of Urban Planning and Community Development and ...,14:51.6
/watch?v=1xvP3lIFqUE&pp=ygUSQ2hhcmxvdHRlIHVyYmFuaXNt,/@urbanistplatform,Urbanist Platform,Have you met Charlotte? | Urban Planner | URBANIST PLATFORM,344,6 years,"We sit down for an up close and personal interview with Urban Planner, Charlotte Morphet. Professionally, Charlotte is an Urban ...",14:51.6
/watch?v=p7bjHBoP7A8&pp=ygUSQ2hhcmxvdHRlIHVyYmFuaXNt,/@Congress4NewUrbanism,Congress for the New Urbanism,Urbanism and faith communities,467,2 years,"Discussion of building urbanism on sites related to houses of worship in cities and towns. Representatives of projects in Charlotte, ...",14:51.6
/watch?v=B2JYKf8MqYc&pp=ygUSQ2hhcmxvdHRlIHVyYmFuaXNt,/@unccharlotteofficial,UNC Charlotte,The Live Wire - KEEPING WATCH on WATER: City of Creeks,603,10 years,"Crista Cammaroto, Director of Galleries in the College of Arts + Architecture, and Mary Newsom, Associate Director, Urban ...",14:51.6
/watch?v=5lbM2QrEm7I&pp=ygUSQ2hhcmxvdHRlIHVyYmFuaXNt,/@ActiveTowns,Active Towns,Tesho Akindele shares his wild journey to building walkable communities,758,2 years,"In this episode, I reconnect with former pro soccer player, Tesho Akindele, for a conversation about his unlikely and unexpected ...",14:51.6
/watch?v=yOGIXGTYYJ4&pp=ygUSQ2hhcmxvdHRlIHVyYmFuaXNt,/@CityNerd,Ray Delahanty | CityNerd,"Urbanism In North America: Sadly, F Tier Is Insufficiently Bad",438K,2 years,"Why merely rank the urbanism of North American cities when you can organize them into arbitrarily stratified tiers? Yeah, that's ...",14:51.6
/watch?v=JkTL9zQ9wWY&pp=ygUSQ2hhcmxvdHRlIHVyYmFuaXNt,/@CLTPlanning,CLT Planning,Charlotte Urban Design Awards - 2022,381,3 years,The City of Charlotte Urban Design Center and the UNC Charlotte School of Architecture are collaborating on the city's second ...,14:51.6
/shorts/spYHJRO7g5g,/@WCNC,WCNC,#TeshoAkindele discusses #urbanism #advocacy for #CampNorthEnd in #CharlotteNC #WCNC #shorts,354,11 months,The former MLS star shares more about his new path with Danielle Stein: ...,14:51.6
/watch?v=WM3YkiHXM14&pp=ygUSQ2hhcmxvdHRlIHVyYmFuaXNt,/@charlotteurbanists4085,Charlotte Urbanists,"Policy Power Hour: Vision Zero & Charlotte (January 14th, 2023)",71,3 years,After a slew of vehicle fatalities that have rocked Charlotte in the opening week of January have left many citizens shocked and ...,14:51.6
/watch?v=mly5FslnTJc&pp=ygUSQ2hhcmxvdHRlIHVyYmFuaXNt,/@architecture.of.territory,Architecture of Territory | Prof. Milica Topalovic,Charlotte Malterre-Barthes - ARABLE LANDS LOST LANDS,185,2 years,12.11.2020 Charlotte Malterre-Barthes - ARABLE LANDS LOST LANDS Approaching land as a finite resource and investigating ...,14:51.6
/watch?v=Oy3-x_R1ySM&pp=ygUSQ2hhcmxvdHRlIHVyYmFuaXNt,/@TheHarvardGSD,Harvard GSD,"Marc Angélil, Charlotte Malterre-Barthes, and Nicolas Memain, “Migrant Marseille""",1.5K,4 years,"Marc Angélil, Charlotte Malterre-Barthes, and Nicolas Memain, “Migrant Marseille: Architectures of Social Segregation and Urban ...",14:51.6
/watch?v=h6WC020HwN8&pp=ygUSQ2hhcmxvdHRlIHVyYmFuaXNt,/@architecture.of.territory,Architecture of Territory | Prof. Milica Topalovic,Charlotte Malterre-Barthes - SELF-REPAIR FOR A BROKEN DISCIPLINE,1.3K,2 years,Charlotte Malterre-Barthes in conversation with Maria Conen and Mio Tsuneyama 22.05.2023 SELF-REPAIR FOR A BROKEN ...,14:51.6
/watch?v=x7e_Tg9-Zsg&pp=ygUSQ2hhcmxvdHRlIHVyYmFuaXNt,/@internationalconversations,International Celebrations in Architecture,CHARLOTTE PERRIAND & DOMINIKUS BOHM | ICARCH 2023,252,3 years,"International Conversations about Architecture A series of online lectures on architecture, from ancient architecture to ...",14:51.6
/watch?v=XlQtJddi2iY&pp=ygUSQ2hhcmxvdHRlIHVyYmFuaXNt,/@holonomyinc,PHINCOPontiac Holonomy Incubator Network CoDesign,PHINCO Q&A on “Work from Home” Dynamics @Congress for New Urbanism Charlotte Conference 2023,4,2 years,,14:51.6
/watch?v=j1H6ojXcitY&t=11s&pp=ygUSQ2hhcmxvdHRlIHVyYmFuaXNt,/@unccharlotteofficial,UNC Charlotte,"UNC Charlotte 2013 Solar Decathlon House, ""Urban Eden""",3.3K,13 years,"Charlotte, North Carolina, is a fast-growing city, committed to revitalizing its urban center as a vibrant focal point of a thriving ...",14:51.6
/watch?v=hDeDXBhKoD0&pp=ygUSQ2hhcmxvdHRlIHVyYmFuaXNt,/@RoyalCollegeofArt,Royal College of Art,"On Right to the City and Social Reproduction | Dr Charlotte Grace, Royal College of Art",219,10 months,"How can architecture make the possible real? Architecture and Urbanism is full of wise words, positive vibes, good faith and cute ...",14:51.6
/shorts/od-j3T1DFs0,/@streetscaping,Streetscapes,How Can We Design Better Streets?,176K,1 year,How can we improve our streets? Find out more in this video: https://youtu.be/9H2ReVurawI #urbandesign #urbanism ...,14:51.6
/shorts/z8qYX-Nxw-c,/@buildwithbrittaney,Brittaney McMillan,"5 Things I wish I knew before Moving to Charlotte, NC",72K,3 years,Sports: Charlotte is the home to 2 professional teams Hornets (NBA) & Panthers (NFL). Nascar is headquartered in downtown ...,14:51.6
/watch?v=UXrLr6MeyzA&pp=ygUSQ2hhcmxvdHRlIHVyYmFuaXNt,/@OhTheUrbanity,Oh The Urbanity!,Montreal’s Urbanist Transformation: 9 Steps Towards A Better City,127K,2 years,It's always encouraging to see that the European capitals of urban design and livability weren't always like that. The Dutch didn't ...,15:00.2
/watch?v=b594yGx_gS8&pp=ygUSQ2hhcmxvdHRlIHVyYmFuaXNt,/@Aaliyahmclark,Aaliyah M. Clark's Definition of Ambition,THE BEST Neighborhoods in Charlotte for Families,11,4 months,"Looking for the best neighborhoods in Charlotte, NC for families? In this video, I'll walk you through some of Charlotte's most ...",15:00.2
/watch?v=ePIcScnSsaE&pp=ygUSQ2hhcmxvdHRlIHVyYmFuaXNt,/@TheDesignExplainer,The Design Explainer,Every (Almost) Perfectly Designed City Explained in 10 Minutes,No,1 hour,What makes a city feel effortless to live in… and why do even the best ones still crack under pressure? In this episode of Every ...,15:00.2
/watch?v=NjUalGAUHkg&pp=ygUSQ2hhcmxvdHRlIHVyYmFuaXNt,/@monoclemagazine-radio,Monocle Radio,"The Watergate Complex, Washington",25,2 months,Charlotte McDonald-Gibson uncovers the modern story behind the US capital's most infamous building. _ _ Monocle Radio is a ...,15:00.2
/watch?v=_f0BCgx_1YI&pp=ygUSQ2hhcmxvdHRlIHVyYmFuaXNt,/@JohnHolmes3.0,John Holmes,"Charlotte Urbanists: Little Sugar Creek Greenway Tour, Freedom Park (State Bicycle Co. Featured)",390,3 years,The Charlotte Urbanists are an urban activism group that myself (John Holmes) and one of the other co-founders (Jacob U.) run ...,15:00.2
/watch?v=xdyl40Zjorw&pp=ygUSQ2hhcmxvdHRlIHVyYmFuaXNt,/@sustaincharlotte,Sustain Charlotte,Module 1: The Benefits of Complete Streets,25,5 years,Smart Growth America facilitated this interactive workshop about Complete Streets through a partnership with RAO Community ...,15:00.2
/watch?v=eVYd86JJtT8&pp=ygUSQ2hhcmxvdHRlIHVyYmFuaXNt,/@clt_coaa,UNC Charlotte College of Arts + Architecture,ADU  |  The Core Next Door,26,2 years,"A group of UNC Charlotte Architecture students has worked on designing, developing, and prototyping Accessible Dwelling Units ...",15:00.2
/shorts/8MnXBJJy6fo,/@EliMagidsLuxuryHomes,Charlotte NC Luxury and Custom Homes - Eli Magids,Living in Charlotte North Carolina - Why Aren't You Here Yet !,87K,3 years,So living in Charlotte North Carolina is a phenomenal reason to make a move. This video is me taking my morning walk through ...,15:00.3
/watch?v=WWBivTlvnGs&pp=ygUSQ2hhcmxvdHRlIHVyYmFuaXNt,/@ArchitectureFoundation,Architecture Foundation,"Migrant Marseille: Charlotte Malterre-Barthes, Marc Angélil & Something Fantastic",1.2K,5 years,"At 9 AM on November 5, 2018, a pair of buildings in central Marseille collapsed, taking the lives of eight people hailing from ...",15:00.3
/watch?v=agymHzz2jYQ&pp=ygUSQ2hhcmxvdHRlIHVyYmFuaXNt,/@WCNC,WCNC,'It's 100% essential' | Camp North End analyst advocates for more housing density,305,1 year,"On Flashpoint, Tesho Akindele encourages city leaders to go further with housing diversity and density.",15:00.3
/watch?v=IR7qIRlSqZ8&pp=ygUSQ2hhcmxvdHRlIHVyYmFuaXNt,/@clt_coaa,UNC Charlotte College of Arts + Architecture,2022/23 SoA Lecture Series: Elena Vazquez-Peña,58,2 years,soa.charlotte.edu // The SoA Colloquium Series consists of informal presentations by School of Architecture faculty members ...,15:00.3
/watch?v=XOd6FubTtbM&pp=ygUSQ2hhcmxvdHRlIHVyYmFuaXNt,/@WCNC,WCNC,Charlotte City Council votes 7-4 to approve industrial development to residents' dismay,1.2K,5 years,"It's no secret: Charlotte is still booming and growing. The rapid new development is pushing people out, as well as industrial ...",15:00.3
/watch?v=uJ1ePlln6VE&pp=ygUSQ2hhcmxvdHRlIHVyYmFuaXNt,/@OhTheUrbanity,Oh The Urbanity!,Inside The Mind of Urbanism's Biggest Critic,229K,3 years,"There aren't a lot of prominent critics of urbanism out there. Yes, lots of people argue against bike lanes, public transit, or housing ...",15:00.3
/watch?v=CRiw6O5RRH8&pp=ygUSQ2hhcmxvdHRlIHVyYmFuaXNt,/@clt_coaa,UNC Charlotte College of Arts + Architecture,SoA Colloquium Series: Chris Jarrett + Peter Wong / DesignLab,55,2 years,soa.charlotte.edu // The SoA Colloquium Series consists of informal presentations by School of Architecture faculty members ...,15:00.3
/watch?v=_5Yzj1Bji2E&pp=ygUSQ2hhcmxvdHRlIHVyYmFuaXNt,/@ActiveTowns,Active Towns,CNU.Charlotte Front Porch Bike Tour ~ Part One,712,2 years,"Reinventing the Front Porch Bike Tour from Friday, June 2nd, 2023, at the Congress for the New Urbanism in Charlotte, NC, ...",15:00.3
/shorts/fMHh_ks4gGA,/@aroundmeinusa,Around me in USA,Chilling Drive through Uptown Charlotte North Carolina! #shorts,1.8K,2 years,,15:00.3
